{
  "schemaVersion": 1,
  "requestId": "dp800-expansion-secure-lifecycle-r2-20260916",
  "authorId": "dp800-expansion-author-secure-20260916",
  "generatedAt": "2026-09-17T01:08:46.951Z",
  "candidates": [
    {
      "id": "dp800-20260916-d2-035",
      "question": "A DAB deployment pins an approved executable release. Developers use different DAB releases locally. Production configuration validation must remain tied to the deployed release's schema even as newer schemas are published. Which $schema selection policy matches that target?",
      "questionType": "single-select",
      "answerChoices": [
        {
          "id": "a",
          "text": "Use the release-specific schema URL for the pinned production executable."
        },
        {
          "id": "b",
          "text": "Use the latest-release schema URL so validation follows new schema publications."
        },
        {
          "id": "c",
          "text": "Use the release-specific schema matching each author's locally installed DAB version."
        },
        {
          "id": "d",
          "text": "Use the release-specific schema for the next upgrade candidate under evaluation."
        }
      ],
      "correctAnswer": ["a"],
      "explanation": "Select the version-specific schema for the deployed DAB release.",
      "deepExplanation": "The validation target is the pinned production release, not the latest publication, an author's local runtime or a separate upgrade experiment. Those other schema selections can serve their corresponding targets. A schema reference selects validation rules; it does not upgrade the executable.",
      "whyOtherAnswersAreWrong": {
        "b": "The latest alias can follow newer schema publications instead of remaining tied to the pinned release. It suits a workflow deliberately tracking the latest compatible runtime, not this fixed validation target.",
        "c": "Matching a local runtime is useful for local configuration work. Because local versions differ, that policy does not consistently target the specified production release.",
        "d": "The upgrade candidate's schema is appropriate when evaluating that candidate. It is not the selected validation contract for the current pinned deployment."
      },
      "objectiveDomain": "secure-optimize-and-deploy-database-solutions",
      "skill": "integrate-sql-solutions-with-azure-services",
      "subskill": "Create configuration files for Data API builder (DAB)",
      "difficulty": "beginner",
      "complexity": "concept-recall",
      "sourceIds": [
        "dp800-d2-dab-config",
        "dp800-d2x-dab-reference",
        "dp800-d2x-dab-production-catalog"
      ],
      "sourceUrls": [
        "https://learn.microsoft.com/en-us/training/modules/integrate-sql-solutions-azure-services/2-create-configuration-files-data-api-builder",
        "https://learn.microsoft.com/en-us/azure/data-api-builder/configuration/",
        "https://learn.microsoft.com/en-us/azure/data-api-builder/"
      ],
      "documentationTitles": [
        "Create configuration files for data API builder",
        "Data API builder configuration schema reference",
        "Data API builder documentation"
      ],
      "generatedAt": "2026-09-17T01:08:46.951Z",
      "lastValidatedAt": "2026-09-17T01:08:46.951Z",
      "featureStatus": "GA",
      "tags": ["data-api-builder", "configuration-schema", "version-pinning"],
      "conceptId": "dab-versioned-schema-validation-must-match-pinned-runtime-not-upgrade-it",
      "verificationStatus": "candidate",
      "verifiedAgainstSourceIds": [],
      "verificationNotes": "Fresh pass-1 lifecycle-r2 citation update. The admitted production catalog is reused with its original dates; prior held snapshots are not overwritten. Both independent technical and adversarial passes must review this hash.",
      "requiresManualReview": true,
      "sourceLastReviewedAt": "2026-09-17T00:25:07.927Z",
      "confidenceReason": "Scoped production configuration/runtime evidence now accompanies the corrected text; no blanket approval of unknown versions or features and no inherited review approval."
    },
    {
      "id": "dp800-20260916-d2-038",
      "question": "The following fragment shows the final effective runtime and Shipment entity settings after configuration loading for a DAB 2.0 service. No other configuration or gateway rewriting changes these settings. Shipment has a suitable key, caller read permissions and GraphQL enabled. Which pair gives the REST collection path and the single GraphQL endpoint path?",
      "questionType": "code",
      "answerChoices": [
        {
          "id": "a",
          "text": "REST: /data/shipments; GraphQL: /query."
        },
        {
          "id": "b",
          "text": "REST: /shipments; GraphQL: /query/Shipment."
        },
        {
          "id": "c",
          "text": "REST: /data/Shipment; GraphQL: /graphql."
        },
        {
          "id": "d",
          "text": "REST: /query/shipments; GraphQL: /data."
        }
      ],
      "correctAnswer": ["a"],
      "explanation": "The effective REST prefix and entity route produce /data/shipments; the effective GraphQL path is /query.",
      "deepExplanation": "Compose the entity's REST path with the effective global REST prefix. GraphQL uses its effective common endpoint, without an entity suffix. The stem now supplies the resolved settings, so determining which source file or fallback supplied them is outside this routing question.",
      "whyOtherAnswersAreWrong": {
        "b": "This pair omits the effective /data REST prefix and adds an entity suffix to the effective /query GraphQL path. Such paths would require different explicit global routing settings, not composition of the settings supplied here.",
        "c": "This pair uses the entity name and a default-style GraphQL path instead of the effective overrides. It could fit a configuration without those overrides, but the resolved settings explicitly specify /shipments and /query.",
        "d": "This pair would fit effective runtime paths REST /query and GraphQL /data. The question now expressly supplies the final effective paths as REST /data and GraphQL /query, excluding a different controlling configuration without asserting a universal child-runtime rule."
      },
      "objectiveDomain": "secure-optimize-and-deploy-database-solutions",
      "skill": "integrate-sql-solutions-with-azure-services",
      "subskill": "Configure REST or GraphQL endpoints",
      "difficulty": "intermediate",
      "complexity": "technical-implementation",
      "sourceIds": [
        "dp800-d2-dab-config",
        "dp800-d2x-dab-entities-unit",
        "dp800-d2x-dab-reference",
        "dp800-d2x-dab-production-catalog"
      ],
      "sourceUrls": [
        "https://learn.microsoft.com/en-us/training/modules/integrate-sql-solutions-azure-services/2-create-configuration-files-data-api-builder",
        "https://learn.microsoft.com/en-us/training/modules/integrate-sql-solutions-azure-services/3-define-entities-rest-graphql",
        "https://learn.microsoft.com/en-us/azure/data-api-builder/configuration/",
        "https://learn.microsoft.com/en-us/azure/data-api-builder/"
      ],
      "documentationTitles": [
        "Create configuration files for data API builder",
        "Define entities for REST and GraphQL",
        "Data API builder configuration schema reference",
        "Data API builder documentation"
      ],
      "generatedAt": "2026-09-17T01:08:46.951Z",
      "lastValidatedAt": "2026-09-17T01:08:46.951Z",
      "featureStatus": "GA",
      "tags": ["data-api-builder-2", "rest", "graphql", "routing"],
      "codeLanguage": "json",
      "codeSnippet": "{\n  \"runtime\": {\n    \"rest\": { \"enabled\": true, \"path\": \"/data\" },\n    \"graphql\": { \"enabled\": true, \"path\": \"/query\" }\n  },\n  \"entities\": {\n    \"Shipment\": {\n      \"source\": \"dbo.Shipment\",\n      \"rest\": { \"enabled\": true, \"path\": \"/shipments\" },\n      \"graphql\": { \"enabled\": true }\n    }\n  }\n}",
      "conceptId": "dab-rest-global-prefix-plus-entity-route-separate-from-single-graphql-endpoint",
      "verificationStatus": "candidate",
      "verifiedAgainstSourceIds": [],
      "verificationNotes": "Fresh pass-1 lifecycle-r2 citation update. The admitted production catalog is reused with its original dates; prior held snapshots are not overwritten. Both independent technical and adversarial passes must review this hash.",
      "requiresManualReview": true,
      "sourceLastReviewedAt": "2026-09-17T00:25:07.927Z",
      "confidenceReason": "Scoped production configuration/runtime evidence now accompanies the corrected text; no blanket approval of unknown versions or features and no inherited review approval."
    }
  ]
}
